[
  {
    "id": "aa_001",
    "key": "schedule.delay.employee_late_detected",
    "name": "Employee late detected",
    "description": "Detect when an employee check-in is later than planned.",
    "module": "schedule",
    "ownerDomain": "schedule",
    "trigger": {
      "type": "domain_event",
      "eventKey": "schedule.employee_late_detected",
      "sourceEntityTypes": [
        "work_order",
        "customer",
        "employee",
        "case",
        "message"
      ]
    },
    "conditions": [
      {
        "key": "schedule.delay.employee_late_detected.condition.default",
        "description": "Domain-specific condition placeholder for future engine. Slice 1 mock only.",
        "type": "custom_domain_check",
        "config": {
          "mock": true
        }
      }
    ],
    "actions": [
      {
        "key": "schedule.delay.employee_late_detected.action.log",
        "description": "Create execution log entry.",
        "type": "create_log",
        "target": "internal",
        "config": {
          "mock": true
        }
      }
    ],
    "status": "active",
    "riskLevel": "medium",
    "executionMode": "auto_execute_with_log",
    "approvalPolicy": {
      "required": false,
      "requiredRole": null,
      "allowEditBeforeApproval": false,
      "allowReject": false,
      "allowAutoExecuteAfterApproval": false,
      "reasonRequiredOnReject": false
    },
    "supportsAi": false,
    "aiEnabled": false,
    "version": 1,
    "tags": [
      "schedule",
      "medium",
      "mock_seed"
    ],
    "latestRunAt": null,
    "createdAt": "2026-06-11T00:00:00Z",
    "updatedAt": "2026-06-11T00:00:00Z",
    "resourceProfile": "medium"
  },
  {
    "id": "aa_002",
    "key": "schedule.delay.impact_detected",
    "name": "Delay impact detected",
    "description": "Detect whether a late arrival may affect the next assignment ETA.",
    "module": "schedule",
    "ownerDomain": "schedule",
    "trigger": {
      "type": "domain_event",
      "eventKey": "schedule.delay_impact_detected",
      "sourceEntityTypes": [
        "work_order",
        "customer",
        "employee",
        "case",
        "message"
      ]
    },
    "conditions": [
      {
        "key": "schedule.delay.impact_detected.condition.default",
        "description": "Domain-specific condition placeholder for future engine. Slice 1 mock only.",
        "type": "custom_domain_check",
        "config": {
          "mock": true
        }
      }
    ],
    "actions": [
      {
        "key": "schedule.delay.impact_detected.action.log",
        "description": "Create execution log entry.",
        "type": "create_log",
        "target": "internal",
        "config": {
          "mock": true
        }
      }
    ],
    "status": "planned",
    "riskLevel": "medium",
    "executionMode": "auto_execute_with_notification",
    "approvalPolicy": {
      "required": false,
      "requiredRole": null,
      "allowEditBeforeApproval": false,
      "allowReject": false,
      "allowAutoExecuteAfterApproval": false,
      "reasonRequiredOnReject": false
    },
    "supportsAi": true,
    "aiEnabled": false,
    "version": 1,
    "tags": [
      "schedule",
      "medium",
      "mock_seed"
    ],
    "latestRunAt": null,
    "createdAt": "2026-06-11T00:00:00Z",
    "updatedAt": "2026-06-11T00:00:00Z",
    "resourceProfile": "heavy",
    "safetyLimitKeys": [
      "schedule.booking_list.session_read_limit",
      "schedule.schedule_grid.data_window_limit"
    ],
    "timeoutMs": 10000,
    "maxRetries": 2,
    "runtimeGuardPolicyKeys": [
      "runtime.guard.schedule_grid_bounded_reads"
    ]
  },
  {
    "id": "aa_003",
    "key": "schedule.delay.employee_confirmation_requested",
    "name": "Employee delay confirmation requested",
    "description": "Ask assigned employees whether the next assignment will be delayed.",
    "module": "schedule",
    "ownerDomain": "schedule",
    "trigger": {
      "type": "domain_event",
      "eventKey": "schedule.delay_impact_detected",
      "sourceEntityTypes": [
        "work_order",
        "customer",
        "employee",
        "case",
        "message"
      ]
    },
    "conditions": [
      {
        "key": "schedule.delay.employee_confirmation_requested.condition.default",
        "description": "Domain-specific condition placeholder for future engine. Slice 1 mock only.",
        "type": "custom_domain_check",
        "config": {
          "mock": true
        }
      }
    ],
    "actions": [
      {
        "key": "schedule.delay.employee_confirmation_requested.action.log",
        "description": "Create execution log entry.",
        "type": "create_log",
        "target": "internal",
        "config": {
          "mock": true
        }
      }
    ],
    "status": "planned",
    "riskLevel": "medium",
    "executionMode": "auto_execute_with_notification",
    "approvalPolicy": {
      "required": false,
      "requiredRole": null,
      "allowEditBeforeApproval": false,
      "allowReject": false,
      "allowAutoExecuteAfterApproval": false,
      "reasonRequiredOnReject": false
    },
    "supportsAi": false,
    "aiEnabled": false,
    "version": 1,
    "tags": [
      "schedule",
      "medium",
      "mock_seed"
    ],
    "latestRunAt": "2026-06-07T08:03:00Z",
    "createdAt": "2026-06-11T00:00:00Z",
    "updatedAt": "2026-06-11T00:00:00Z",
    "resourceProfile": "medium"
  },
  {
    "id": "aa_004",
    "key": "schedule.delay.no_customer_impact_logged",
    "name": "No customer impact logged",
    "description": "Log delay where employees confirm no customer impact.",
    "module": "schedule",
    "ownerDomain": "schedule",
    "trigger": {
      "type": "domain_event",
      "eventKey": "schedule.employee_confirmed_no_delay_impact",
      "sourceEntityTypes": [
        "work_order",
        "customer",
        "employee",
        "case",
        "message"
      ]
    },
    "conditions": [
      {
        "key": "schedule.delay.no_customer_impact_logged.condition.default",
        "description": "Domain-specific condition placeholder for future engine. Slice 1 mock only.",
        "type": "custom_domain_check",
        "config": {
          "mock": true
        }
      }
    ],
    "actions": [
      {
        "key": "schedule.delay.no_customer_impact_logged.action.log",
        "description": "Create execution log entry.",
        "type": "create_log",
        "target": "internal",
        "config": {
          "mock": true
        }
      }
    ],
    "status": "planned",
    "riskLevel": "low",
    "executionMode": "auto_execute_with_log",
    "approvalPolicy": {
      "required": false,
      "requiredRole": null,
      "allowEditBeforeApproval": false,
      "allowReject": false,
      "allowAutoExecuteAfterApproval": false,
      "reasonRequiredOnReject": false
    },
    "supportsAi": false,
    "aiEnabled": false,
    "version": 1,
    "tags": [
      "schedule",
      "low",
      "mock_seed"
    ],
    "latestRunAt": null,
    "createdAt": "2026-06-11T00:00:00Z",
    "updatedAt": "2026-06-11T00:00:00Z",
    "resourceProfile": "medium"
  },
  {
    "id": "aa_005",
    "key": "schedule.delay.eta_updated",
    "name": "ETA updated after confirmed delay",
    "description": "Update estimated arrival time while preserving planned time.",
    "module": "schedule",
    "ownerDomain": "schedule",
    "trigger": {
      "type": "domain_event",
      "eventKey": "schedule.employee_confirmed_delay_impact",
      "sourceEntityTypes": [
        "work_order",
        "customer",
        "employee",
        "case",
        "message"
      ]
    },
    "conditions": [
      {
        "key": "schedule.delay.eta_updated.condition.default",
        "description": "Domain-specific condition placeholder for future engine. Slice 1 mock only.",
        "type": "custom_domain_check",
        "config": {
          "mock": true
        }
      }
    ],
    "actions": [
      {
        "key": "schedule.delay.eta_updated.action.log",
        "description": "Create execution log entry.",
        "type": "create_log",
        "target": "internal",
        "config": {
          "mock": true
        }
      }
    ],
    "status": "planned",
    "riskLevel": "medium",
    "executionMode": "auto_execute_with_notification",
    "approvalPolicy": {
      "required": false,
      "requiredRole": null,
      "allowEditBeforeApproval": false,
      "allowReject": false,
      "allowAutoExecuteAfterApproval": false,
      "reasonRequiredOnReject": false
    },
    "supportsAi": false,
    "aiEnabled": false,
    "version": 1,
    "tags": [
      "schedule",
      "medium",
      "mock_seed"
    ],
    "latestRunAt": null,
    "createdAt": "2026-06-11T00:00:00Z",
    "updatedAt": "2026-06-11T00:00:00Z",
    "resourceProfile": "medium"
  },
  {
    "id": "aa_006",
    "key": "schedule.delay.customer_app_notification_sent",
    "name": "Customer app delay notification",
    "description": "Send standard app notification when customer opted in and delay is deterministic.",
    "module": "schedule",
    "ownerDomain": "schedule",
    "trigger": {
      "type": "domain_event",
      "eventKey": "schedule.eta_updated",
      "sourceEntityTypes": [
        "work_order",
        "customer",
        "employee",
        "case",
        "message"
      ]
    },
    "conditions": [
      {
        "key": "schedule.delay.customer_app_notification_sent.condition.default",
        "description": "Domain-specific condition placeholder for future engine. Slice 1 mock only.",
        "type": "custom_domain_check",
        "config": {
          "mock": true
        }
      }
    ],
    "actions": [
      {
        "key": "schedule.delay.customer_app_notification_sent.action.log",
        "description": "Create execution log entry.",
        "type": "create_log",
        "target": "internal",
        "config": {
          "mock": true
        }
      }
    ],
    "status": "planned",
    "riskLevel": "medium",